{
  "schema_version": 2,
  "run_id": "20260908T072415Z-idempotent-settlement-retries",
  "state": "TARGET_REACHED",
  "plan": {
    "path": "/home/muszkin/work/zilch/card-authorization-service/context/plans/2026-09-08-idempotent-settlement-retries.md",
    "sha256": "ac3912ffe26bd6b816c2bb73b9d452177d071a6fe498f71d5fadfbd6c7bd5d50",
    "approved_base_sha": "37e3d118c1116bb2e28ae754a26156f7c44100eb"
  },
  "context": {
    "index_path": "/home/muszkin/work/zilch/card-authorization-service/context/map/INDEX.md",
    "manifest_path": "/home/muszkin/work/zilch/card-authorization-service/context/map/manifest.json",
    "manifest_digest": "ae4b0021ba624099db0c9032fc450959ad9679bc1e0ad3ba83c93ecb75fc2752",
    "source_revision": "b4bef1631aa5cfb1efc1655b06e36f38c788f40a",
    "inventory_fingerprint": "71a66297627b16ccac87d938cfac1bfa76d6b5e36ff2de905610c43640b2e38e",
    "generated_at": "2026-09-07T14:57:44Z"
  },
  "execution_contract": {
    "profile": "standard",
    "orchestration": "fire-and-forget",
    "terminal_outcome": "integration-merged",
    "selection_source": "operator-confirmed",
    "confirmed_at": "2026-09-08T07:24:15Z",
    "automatic_profile_escalation": true,
    "model_policy": {
      "policy": "daily-coding",
      "worker_requested": "sonnet",
      "worker_resolved": "claude-sonnet-5",
      "worker_reasoning": "medium",
      "reviewer_requested": "sonnet",
      "reviewer_resolved": "claude-sonnet-5",
      "reviewer_reasoning": "medium"
    },
    "profile_history": []
  },
  "authorization_path": "authorization.md",
  "topology_path": "topology.md",
  "feature": {
    "branch": "feat/idempotent-settlement-retries",
    "worktree": "/home/muszkin/work/zilch/worktrees/feature",
    "head_sha": "316edc28ae2b194ef898c543926845379cc0a1cf"
  },
  "slices": {
    "S1": {
      "state": "INTEGRATED",
      "owner": "worker-S1",
      "branch": "feat/idempotent-settlement-retries-s1",
      "worktree": "/home/muszkin/work/zilch/worktrees/s1",
      "parent_sha": "37e3d118c1116bb2e28ae754a26156f7c44100eb",
      "head_sha": "ddd71fada0e301552715ec135e4e3366dd328068",
      "packet": "slices/S1/packet.md",
      "gates": {
        "baseline": "PASS",
        "acceptance_red": "PASS",
        "focused": "PASS",
        "static": "PASS",
        "sonar": "NOT_APPLICABLE",
        "review": "PASS",
        "e2e": "PASS"
      },
      "candidate_commits": [
        "f0f62f4be99a43b7a388dc1c8689caa342e98c53",
        "ddd71fada0e301552715ec135e4e3366dd328068"
      ]
    },
    "R1": {
      "state": "INTEGRATED",
      "owner": "repair-worker-R1",
      "branch": "feat/idempotent-settlement-retries-r1",
      "worktree": "/home/muszkin/work/zilch/worktrees/r1",
      "parent_sha": "3ddbb487e14a749b538a3536207c492f96ac9f65",
      "head_sha": "80528ab665a5ce44294b69bd90adb60a0051be58",
      "packet": "slices/R1/packet.md",
      "kind": "repair",
      "repairs": "final-e2e flaky-or-environmental at 3ddbb487e14a749b538a3536207c492f96ac9f65",
      "gates": {
        "reproduction": "PASS",
        "focused": "PASS",
        "static": "PASS",
        "sonar": "NOT_APPLICABLE",
        "review": "PASS",
        "e2e": "PASS"
      }
    }
  },
  "deferred_obligations": [],
  "integration_pr": {
    "url": "https://github.com/muszkin/card-authorization-service/pull/1",
    "number": 1,
    "head_sha": "316edc28ae2b194ef898c543926845379cc0a1cf",
    "required_checks": [
      {
        "name": "build",
        "run_id": 34203130083,
        "conclusion": "success"
      }
    ],
    "merge_method": "rebase",
    "merged_main_sha": "4b89d49062ecff9e743f458afe4cc50b15585bea"
  },
  "staging": {
    "status": "NOT_APPLICABLE",
    "expected_source_sha": null,
    "expected_artifact_digest": null,
    "observed_source_sha": null,
    "observed_artifact_digest": null
  },
  "production_pr": null,
  "production": {
    "status": "NOT_APPLICABLE",
    "expected_artifact_digest": null,
    "observed_artifact_digest": null,
    "verification_path": null,
    "observation_window": null,
    "rollback_status": "NOT_NEEDED"
  },
  "updated_at": "2026-09-08T08:15:51Z"
}